00:35:58.813682 IP JanBerktold.fritz.box.2008 > 192.168.178.255.2008: UDP, length 16
00:35:58.815133 IP JanBerktold.fritz.box.2008 > 192.168.178.255.2008: UDP, length 16
00:35:58.998898 IP JanBerktold.fritz.box.2008 > 192.168.178.255.2008: UDP, length 16
00:35:58.999134 IP JanBerktold.fritz.box.2008 > 192.168.178.255.2008: UDP, length 16
00:35:59.201377 IP JanBerktold.fritz.box.2008 > 192.168.178.255.2008: UDP, length 16
00:35:59.201968 IP JanBerktold.fritz.box.2008 > 192.168.178.255.2008: UDP, length 16
00:35:59.370964 IP JanBerktold.fritz.box.2008 > 192.168.178.255.2008: UDP, length 16
00:35:59.371582 IP JanBerktold.fritz.box.2008 > 192.168.178.255.2008: UDP, length 16
00:35:59.553621 IP JanBerktold.fritz.box.2008 > 192.168.178.255.2008: UDP, length 16
00:35:59.554164 IP JanBerktold.fritz.box.2008 > 192.168.178.255.2008: UDP, length 16
00:35:59.717320 IP ubuntuserver.fritz.box.42149 > fritz.box.domain: 32553+ PTR? 255.178.168.192.in-addr.arpa. (46)
00:35:59.718072 IP fritz.box.domain > ubuntuserver.fritz.box.42149: 32553 NXDomain* 0/1/0 (106)
00:35:59.718241 IP ubuntuserver.fritz.box.49986 > fritz.box.domain: 41172+ PTR? 22.178.168.192.in-addr.arpa. (45)
00:35:59.719231 IP fritz.box.domain > ubuntuserver.fritz.box.49986: 41172* 1/1/3 PTR JanBerktold.fritz.box. (166)
00:35:59.719395 IP ubuntuserver.fritz.box.50904 > fritz.box.domain: 53292+ PTR? 21.178.168.192.in-addr.arpa. (45)
00:35:59.720181 IP fritz.box.domain > ubuntuserver.fritz.box.50904: 53292* 1/1/3 PTR JanBerktold.fritz.box. (166)
00:35:59.752634 IP JanBerktold.fritz.box.2008 > 192.168.178.255.2008: UDP, length 16
00:35:59.752871 IP JanBerktold.fritz.box.2008 > 192.168.178.255.2008: UDP, length 16
00:35:59.926701 IP JanBerktold.fritz.box.2008 > 192.168.178.255.2008: UDP, length 16
00:35:59.926919 IP JanBerktold.fritz.box.2008 > 192.168.178.255.2008: UDP, length 16
00:36:00.143513 IP JanBerktold.fritz.box.2008 > 192.168.178.255.2008: UDP, length 16
00:36:00.144083 IP JanBerktold.fritz.box.2008 > 192.168.178.255.2008: UDP, length 16
00:36:00.349315 IP JanBerktold.fritz.box.2008 > 192.168.178.255.2008: UDP, length 16
00:36:00.365001 IP JanBerktold.fritz.box.2008 > 192.168.178.255.2008: UDP, length 16
00:36:00.552357 IP JanBerktold.fritz.box.2008 > 192.168.178.255.2008: UDP, length 16
00:36:00.552778 IP JanBerktold.fritz.box.2008 > 192.168.178.255.2008: UDP, length 16
00:36:00.721407 IP ubuntuserver.fritz.box.38326 > fritz.box.domain: 11041+ PTR? 1.178.168.192.in-addr.arpa. (44)
00:36:00.722244 IP fritz.box.domain > ubuntuserver.fritz.box.38326: 11041* 1/1/3 PTR fritz.box. (153)
00:36:00.722371 IP ubuntuserver.fritz.box.43901 > fritz.box.domain: 36201+ PTR? 34.178.168.192.in-addr.arpa. (45)
00:36:00.723199 IP fritz.box.domain > ubuntuserver.fritz.box.43901: 36201* 1/1/3 PTR ubuntuserver.fritz.box. (167)
00:36:00.767687 IP JanBerktold.fritz.box.2008 > 192.168.178.255.2008: UDP, length 16
00:36:00.768093 IP JanBerktold.fritz.box.2008 > 192.168.178.255.2008: UDP, length 16
00:36:00.979263 IP JanBerktold.fritz.box.2008 > 192.168.178.255.2008: UDP, length 16
00:36:00.979480 IP JanBerktold.fritz.box.2008 > 192.168.178.255.2008: UDP, length 16
00:36:01.188186 IP JanBerktold.fritz.box.2008 > 192.168.178.255.2008: UDP, length 16
00:36:01.188592 IP JanBerktold.fritz.box.2008 > 192.168.178.255.2008: UDP, length 16
00:36:01.401442 IP JanBerktold.fritz.box.2008 > 192.168.178.255.2008: UDP, length 16
00:36:01.401680 IP JanBerktold.fritz.box.2008 > 192.168.178.255.2008: UDP, length 16
00:36:01.620144 IP JanBerktold.fritz.box.2008 > 192.168.178.255.2008: UDP, length 16
00:36:01.620270 IP JanBerktold.fritz.box.2008 > 192.168.178.255.2008: UDP, length 16
00:36:01.807935 IP JanBerktold.fritz.box.2008 > 192.168.178.255.2008: UDP, length 16
00:36:01.817253 IP JanBerktold.fritz.box.2008 > 192.168.178.255.2008: UDP, length 16
00:36:01.979192 IP JanBerktold.fritz.box.2008 > 192.168.178.255.2008: UDP, length 16
00:36:01.979370 IP JanBerktold.fritz.box.2008 > 192.168.178.255.2008: UDP, length 16
00:36:02.184089 IP JanBerktold.fritz.box.2008 > 192.168.178.255.2008: UDP, length 16
00:36:02.184680 IP JanBerktold.fritz.box.2008 > 192.168.178.255.2008: UDP, length 16
00:36:02.408261 IP JanBerktold.fritz.box.2008 > 192.168.178.255.2008: UDP, length 16
00:36:02.408698 IP JanBerktold.fritz.box.2008 > 192.168.178.255.2008: UDP, length 16
00:36:02.598137 IP JanBerktold.fritz.box.2008 > 192.168.178.255.2008: UDP, length 16
00:36:02.598551 IP JanBerktold.fritz.box.2008 > 192.168.178.255.2008: UDP, length 16
00:36:03.257401 IP JanBerktold.fritz.box.2008 > 192.168.178.255.2008: UDP, length 16
00:36:03.257771 IP JanBerktold.fritz.box.2008 > 192.168.178.255.2008: UDP, length 16
00:36:03.453032 IP JanBerktold.fritz.box.2008 > 192.168.178.255.2008: UDP, length 16
00:36:03.453456 IP JanBerktold.fritz.box.2008 > 192.168.178.255.2008: UDP, length 16
00:36:03.691279 IP JanBerktold.fritz.box.2008 > 192.168.178.255.2008: UDP, length 16
00:36:03.691574 IP JanBerktold.fritz.box.2008 > 192.168.178.255.2008: UDP, length 16
00:36:03.913014 IP JanBerktold.fritz.box.2008 > 192.168.178.255.2008: UDP, length 16
00:36:03.913021 IP JanBerktold.fritz.box.2008 > 192.168.178.255.2008: UDP, length 16
00:36:04.134664 IP JanBerktold.fritz.box.2008 > 192.168.178.255.2008: UDP, length 16
00:36:04.134790 IP JanBerktold.fritz.box.2008 > 192.168.178.255.2008: UDP, length 16
00:36:04.361558 IP JanBerktold.fritz.box.2008 > 192.168.178.255.2008: UDP, length 16
00:36:04.361645 IP JanBerktold.fritz.box.2008 > 192.168.178.255.2008: UDP, length 16
00:36:04.544708 IP JanBerktold.fritz.box.2008 > 192.168.178.255.2008: UDP, length 16
00:36:04.544934 IP JanBerktold.fritz.box.2008 > 192.168.178.255.2008: UDP, length 16
00:36:04.711806 IP JanBerktold.fritz.box.2008 > 192.168.178.255.2008: UDP, length 16
00:36:04.712503 IP JanBerktold.fritz.box.2008 > 192.168.178.255.2008: UDP, length 16
00:36:04.919836 IP JanBerktold.fritz.box.2008 > 192.168.178.255.2008: UDP, length 16
00:36:04.919843 IP JanBerktold.fritz.box.2008 > 192.168.178.255.2008: UDP, length 16
00:36:05.136963 IP JanBerktold.fritz.box.2008 > 192.168.178.255.2008: UDP, length 16
00:36:05.137379 IP JanBerktold.fritz.box.2008 > 192.168.178.255.2008: UDP, length 16
00:36:05.357175 IP JanBerktold.fritz.box.2008 > 192.168.178.255.2008: UDP, length 16
00:36:05.357397 IP JanBerktold.fritz.box.2008 > 192.168.178.255.2008: UDP, length 16
00:36:05.544354 IP JanBerktold.fritz.box.2008 > 192.168.178.255.2008: UDP, length 16
00:36:05.544772 IP JanBerktold.fritz.box.2008 > 192.168.178.255.2008: UDP, length 16
00:36:05.721197 IP JanBerktold.fritz.box.2008 > 192.168.178.255.2008: UDP, length 16
00:36:05.721204 IP JanBerktold.fritz.box.2008 > 192.168.178.255.2008: UDP, length 16
00:36:05.918030 IP JanBerktold.fritz.box.2008 > 192.168.178.255.2008: UDP, length 16
00:36:05.918278 IP JanBerktold.fritz.box.2008 > 192.168.178.255.2008: UDP, length 16
00:36:06.117541 IP JanBerktold.fritz.box.2008 > 192.168.178.255.2008: UDP, length 16
00:36:06.117960 IP JanBerktold.fritz.box.2008 > 192.168.178.255.2008: UDP, length 16
00:36:06.287134 IP JanBerktold.fritz.box.2008 > 192.168.178.255.2008: UDP, length 16
00:36:06.289256 IP JanBerktold.fritz.box.2008 > 192.168.178.255.2008: UDP, length 16
00:36:06.474101 IP JanBerktold.fritz.box.2008 > 192.168.178.255.2008: UDP, length 16
00:36:06.474634 IP JanBerktold.fritz.box.2008 > 192.168.178.255.2008: UDP, length 16
00:36:06.655885 IP JanBerktold.fritz.box.2008 > 192.168.178.255.2008: UDP, length 16
00:36:06.656092 IP JanBerktold.fritz.box.2008 > 192.168.178.255.2008: UDP, length 16
00:36:06.893983 IP JanBerktold.fritz.box.2008 > 192.168.178.255.2008: UDP, length 16
00:36:06.894070 IP JanBerktold.fritz.box.2008 > 192.168.178.255.2008: UDP, length 16
00:36:07.108184 IP JanBerktold.fritz.box.2008 > 192.168.178.255.2008: UDP, length 16
00:36:07.108221 IP JanBerktold.fritz.box.2008 > 192.168.178.255.2008: UDP, length 16
00:36:07.345717 IP JanBerktold.fritz.box.2008 > 192.168.178.255.2008: UDP, length 16
00:36:07.346120 IP JanBerktold.fritz.box.2008 > 192.168.178.255.2008: UDP, length 16
00:36:07.543789 IP JanBerktold.fritz.box.2008 > 192.168.178.255.2008: UDP, length 16
00:36:07.547804 IP JanBerktold.fritz.box.2008 > 192.168.178.255.2008: UDP, length 16
00:36:07.710553 IP JanBerktold.fritz.box.2008 > 192.168.178.255.2008: UDP, length 16
00:36:07.710975 IP JanBerktold.fritz.box.2008 > 192.168.178.255.2008: UDP, length 16
00:36:07.953873 IP JanBerktold.fritz.box.2008 > 192.168.178.255.2008: UDP, length 16
00:36:07.954472 IP JanBerktold.fritz.box.2008 > 192.168.178.255.2008: UDP, length 16
00:36:08.158125 IP JanBerktold.fritz.box.2008 > 192.168.178.255.2008: UDP, length 16
00:36:08.158557 IP JanBerktold.fritz.box.2008 > 192.168.178.255.2008: UDP, length 16
00:36:08.354685 IP JanBerktold.fritz.box.2008 > 192.168.178.255.2008: UDP, length 16
00:36:08.355113 IP JanBerktold.fritz.box.2008 > 192.168.178.255.2008: UDP, length 16
00:36:08.526374 IP JanBerktold.fritz.box.2008 > 192.168.178.255.2008: UDP, length 16
00:36:08.526785 IP JanBerktold.fritz.box.2008 > 192.168.178.255.2008: UDP, length 16

